{
  "schema_version": "1.0",
  "task_id": "single-bin-pack-handoff-001",
  "instruction": "将工作区中的四个红色零件依次装入料箱；倒放零件先调整为正向。装箱完成后，将料箱放到中央交接位并返回 HOME_A。失败时重新观察后继续。",
  "task_type": "pick_place",
  "target_object": "industrial_part",
  "target_location": "FINISHED_01",
  "constraints": {
    "topology": "FIXED_DUAL_VLA_SERIAL",
    "online_ground_truth": false
  },
  "metadata": {
    "profile_id": "single_bin_pack_handoff_v1"
  },
  "postconditions": [
    {
      "kind": "field_equals",
      "path": "task.bin_at_finished",
      "expected": true,
      "min_confidence": 0.6,
      "required_votes": 2
    }
  ]
}
