{
  "schema_version": "1.0",
  "task_id": "P01_TO_S11",
  "instruction": "请将螺母 P01 放置到料箱的 S11 格子中。",
  "task_type": "pick_place",
  "target_object": "P01",
  "target_location": "S11",
  "constraints": {
    "scene_id": "single_bin_manual_industrial_v2",
    "online_ground_truth": false
  },
  "metadata": {
    "profile_id": "single_bin_manual_industrial_v2",
    "subtask_id": "P01_TO_S11"
  },
  "postconditions": [
    {
      "kind": "object_in_zone",
      "object_id": "P01",
      "zone_id": "S11",
      "min_confidence": 0.6,
      "required_votes": 2
    }
  ]
}
