{
  "schema_version": "1.0",
  "task_id": "W01_TO_S14",
  "instruction": "请将扳手 W01 放置到料箱的 S14 格子中。",
  "task_type": "pick_place",
  "target_object": "W01",
  "target_location": "S14",
  "constraints": {
    "scene_id": "single_bin_manual_industrial_v2",
    "online_ground_truth": false
  },
  "metadata": {
    "profile_id": "single_bin_manual_industrial_v2",
    "subtask_id": "W01_TO_S14"
  },
  "postconditions": [
    {
      "kind": "object_in_zone",
      "object_id": "W01",
      "zone_id": "S14",
      "min_confidence": 0.6,
      "required_votes": 2
    }
  ]
}
